Index,Text
Lecture4_Chunk51,"and it represents the absence of a value. What's that?
Not a string.
Not a--
None is not a string.
None is not a string, exactly. It's a special type.
OK so before we go on, I wanted to go through a small exercise in Spyder just to show you the
difference that None and printing and returning makes. So here are two functions that I wrote.
One is is_even_with_return. That's its name, so pretty descriptive. It's pretty much the same"
Lecture4_Chunk52,"One is is_even_with_return. That's its name, so pretty descriptive. It's pretty much the same
code we saw in the slides. It just has this extra little print thing. It gets the remainder when i is
divided by 2. And it returns whether the remainder is equal to 0. So it'll either return a true or a
false-- a Boolean.
OK so my function call is this: I'm saying is_even_with_return with a value 3. When I make this"
Lecture4_Chunk53,"OK so my function call is this: I'm saying is_even_with_return with a value 3. When I make this
function call, this 3 gets mapped into here-- this variable here-- so i is equal to 3. I'm going to
print with return, and then I'm going to say remainder is equal to 3 percent 2, which comes out
to value 1, because there's a remainder 1. And I'm going to return whether 1 is equal to 0,
which is false."
Lecture4_Chunk54,"which is false.
So this line here returns false, but am I doing anything with the false? Not really. It's just sort of
sitting in the code here. So this gets evaluated to false. I'm not printing it. I'm not doing any
operations with it. It's just sitting there. So it won't show up anywhere. If I want the result to
show up somewhere, then I have to print it. So that's what this next line is doing. So that one
should be straightforward."
Lecture4_Chunk55,"should be straightforward.
is_even_without_return's a little bit trickier, but not too bad. I have print, without_return inside
here, and then I'm going to get a remainder is equal to i percent 2. And notice that I'm not-- I
don't have any return. So implicitly, Python's going to add a return None for me, like that. You
don't have to add it.
So when I make the function call here, it's going to do the same thing, except that return in this"
Lecture4_Chunk56,"So when I make the function call here, it's going to do the same thing, except that return in this
case is not going to be a Boolean. It's going to be this special None. So this is going to get
evaluated to None.
Again I'm not printing it out. It's just sitting there. If I were to print out the result of that, you'd
be printing out this value None, which if I run it, you'll see here it just prints it out right there."
Lecture4_Chunk57,"So as you're doing your next p set, it's about functions and you're seeing these Nones popping
out in some places. Check to make sure that you've actually returned something, as opposed
to just printed something inside the function like we did here. All right so that's the difference.
And the last thing I want to mention about this is_even function is how useful it can be. So
notice this is the function as in the slides, and once you write the function once, you can use it"
Lecture4_Chunk58,"notice this is the function as in the slides, and once you write the function once, you can use it
many, many times in your code. So here I'm using the function is_even to print the numbers
between 0 and 19, including and whether the number is even or odd.
So notice this piece of code here, once I've written this function is_even, looks really, really
nice right? I have for all the numbers in this range if the number i is even, this is going to"
Lecture4_Chunk59,"nice right? I have for all the numbers in this range if the number i is even, this is going to
return a true or false for all the numbers 0, 1, 2, 3, 4. If it's true, then I'm going to print out
even, and otherwise I'm going to print out odd.
So if I run this, it's going to do this. 0 even, 1 odd, 2 even, and so on. So notice using functions
makes my code really nice looking. If I wasn't using functions, I'd have to put these two lines"
Lecture4_Chunk60,"makes my code really nice looking. If I wasn't using functions, I'd have to put these two lines
somewhere inside here and it would look a little bit messier.
So I've said this maybe once or twice before: in Python everything is an object. Might not have
meant anything back then, but I think you're going to see what I mean using this particular
example. So if in Python everything's an object-- integers are objects, floats are objects, even"
Lecture4_Chunk61,"example. So if in Python everything's an object-- integers are objects, floats are objects, even
functions are objects. So as you can pass objects as parameters back and forth as function
parameters, you can also pass other functions as parameters.
Let's see what this means. So we have three function definitions here-- func_a, func_b, and
func_c. And then I have three lines of code here in my main program. So I have one called a"
Lecture4_Chunk62,"func_c. And then I have three lines of code here in my main program. So I have one called a
func_a, one called a func_b, and one call to func_c. Let's trace through, just like in the
previous example, and see what exactly happens.
First thing I create is my global scope. And I have three function definitions. Again I don't care
what's in the code yet, because I haven't called the functions yet. Python just knows there's
these functions with these names that contain some code."
Lecture4_Chunk63,"these functions with these names that contain some code.
After these definitions, I come to this line here-- print func_a. As soon as I make a function call,
I'm going to create a new scope and I'm going to hop into there. Inside func_a, I'm going to go
and look at what func_a does. It doesn't take in the parameters, it just prints out this message
here. And then it leaves; it's done. There's no return, so we return None. So func_a returns"
Lecture4_Chunk64,"here. And then it leaves; it's done. There's no return, so we return None. So func_a returns
None to whoever called it, which was that line there, so that is going to be None.
Next line. This one right here-- print 5 plus some function call. Again I'm going to hop into
func_b's scope and see what to do there. So first I'm going to map my parameters. So 2--
whoops-- 2 gets mapped to y. So inside func_b's scope, y is going to get the value 2."
Lecture4_Chunk65,"whoops-- 2 gets mapped to y. So inside func_b's scope, y is going to get the value 2.
That's the very first thing I'm doing-- mapping all the parameters. Then I'm going to print this
thing here, and then I'm going to return y. So inside func_b, y has the value 2, and I'm
returning 2 back to whoever called me. So this is the value 2 and I'm going to print 5 plus 2,
which is 7.
Last one. This is the trickiest. Oop, that popped up. If you think you've got it, try that exercise."
Lecture4_Chunk66,"Last one. This is the trickiest. Oop, that popped up. If you think you've got it, try that exercise.
But otherwise follow along. print func_c func_a. So I see that I am going to enter func_c's
scope. So I'm going to look at what func_c does.
First thing I do is I'm mapping all the parameters. Don't even worry about the fact that this is a
function right now. Just pretend it's x or something. So you say func_a is going to get mapped"
Lecture4_Chunk67,"function right now. Just pretend it's x or something. So you say func_a is going to get mapped
to the variable z inside func_c. So z is func_c. Just mapping parameters from actual to formal.
Then what do we do inside func_c? We print out inside func_c, and then we return z. This is
the cool part. Inside func_c, z is func_a. So if you replace z with func_a, this here becomes
return func_a open close parentheses. Look familiar? We did that function call right there"
Lecture4_Chunk68,"return func_a open close parentheses. Look familiar? We did that function call right there
right? So that's just another function call.
So with that being another function call, you're going to create another scope, and you're
going to pop into that one. So we're one, two, I guess two scopes deep, and we're trying to
figure out where we're going. So func_a's scope is going to be up here.
So what does func_a do? It just prints out this, and it returns None. So we're going to return"
Lecture4_Chunk69,"So what does func_a do? It just prints out this, and it returns None. So we're going to return
None to whoever called us, which was func_c. So this line here becomes return None. And so
this line here is going to return None to whoever called it, which was this line down here. Oops,
I didn't mean to cross that out. So that line here is going to print None.
So if you just go step-by-step, it shouldn't be too bad to try to map what happens with variable"
Lecture4_Chunk70,"So if you just go step-by-step, it shouldn't be too bad to try to map what happens with variable
names and formal parameters and actual parameters. That's why I highly recommend pieces
of paper and pens.
One last thing I want to mention about scope before we do another example. So there are
three sort of situations you might find yourself in. The first one is probably the most typical,
and this is when you define a function. And it's using a variable named x in this case that's also"
Lecture4_Chunk71,"and this is when you define a function. And it's using a variable named x in this case that's also
defined outside of the function. And that doesn't matter because of the idea of scopes.
So inside the global scope, you can have variables x. When you're inside a different scope,
you can have whatever variable names you want. And when you're inside that scope, Python's
going to use those variable names, so they don't interfere with each other at all. So in this"
Lecture4_Chunk72,"going to use those variable names, so they don't interfere with each other at all. So in this
example, I've defined a variable x is equal to 1, and then I incremented, and that doesn't
interfere with the fact that we have a variable x outside.
This one's a little bit trickier. I define this function g, and all g does is access a variable x. But
notice inside g, I've never actually declared or initialized a variable x. In this f, I said x is equal"
Lecture4_Chunk73,"to 1. But in here, I'm just sort of using x. So this does not give you an error. In fact it's OK for
you to do this in Python.
Python says, OK I'm in this scope, but I don't have a variable named x, so let me just go into
the scope of whoever called me. So I'm going to just temporarily hop out of the scope and see
is there variable x outside of me? And it'll find this variable x here, and it's going to print out its
values. So that's OK."
Lecture4_Chunk74,"values. So that's OK.
This last example here is actually not allowed in Python-- similar to this one-- except that I'm
trying to increment a value of x, but then I'm also trying to reassign it to the same value of x.
The problem with that is I never actually initialized x inside h. So if I said-- if inside h, I said x is
equal to 1, and then I did x plus equals to 1, then it would be this example here-- f of y. But I"
Lecture4_Chunk75,"equal to 1, and then I did x plus equals to 1, then it would be this example here-- f of y. But I
didn't do that. I just tried to access x and then incremented and then tried to reassign it. And
that's actually not allowed in Python.
There is a way around it using global variables. But it's actually frowned upon to use global
variables, though global variables are part of the readings for this lecture. And the reason why"
Lecture4_Chunk76,"variables, though global variables are part of the readings for this lecture. And the reason why
it's not a great idea to use global variables is because global variables sort of give you this
loophole around scopes, so it allows you to write code that can become very messy.
So using global variables, you can be inside a function and then modify a variable that's
defined outside of your function. And that sort of defeats the purpose of functions and using"
Lecture4_Chunk77,"defined outside of your function. And that sort of defeats the purpose of functions and using
them in writing these coherent modules that are separate. That said, it might sometimes be
useful to use global variables, as you'll see in a couple lectures from now.
OK cool. So let's go on to the last scope example. OK this slide is here, and notice I've bolded,
underlined, and italicized the Python Tutor, because I find it extremely helpful. So the Python"
Lecture4_Chunk78,"underlined, and italicized the Python Tutor, because I find it extremely helpful. So the Python
Tutor-- as I've mentioned in one of the assignments-- it was actually developed by a grad
student here, or post-grad student slash post-doc here.
And it allows you to go through Python, paste a code, go through it step-by-step. Like with
each iteration, it'll show you exactly what values each variable has, what scope you're in, when"
Lecture4_Chunk79,"each iteration, it'll show you exactly what values each variable has, what scope you're in, when
scopes get created, when scopes get destroyed, variables within each scope. So pretty much
every single detail you need to sort of understand functions.
As we're starting to-- you can see we've had couple questions, and these were great
questions. So if you're still trying to understand what's going on, I would highly suggest you"
Lecture4_Chunk80,"questions. So if you're still trying to understand what's going on, I would highly suggest you
take a piece of code and just run it in the Python Tutor and you should be able to see exactly
what happens, in sort of a similar way that I've drawn my diagrams.
In all of the codes for this particular lecture, I've put links to the Python Tutor for each one of
those exercises. So you can just copy and paste those, and it'll automatically populate it with"
Lecture4_Chunk81,"those exercises. So you can just copy and paste those, and it'll automatically populate it with
that particular example, so you just have to click, step, step, step. OK so having made my plug
for Python Tutor, let's go on.
OK so here's an example. It's going to show couple things. One is print versus return, and also
this idea of you can nest functions. So just like you could have nested loops, nested
conditionals-- you can also nest functions within functions. So let's draw some diagrams just"
Lecture4_Chunk82,"conditionals-- you can also nest functions within functions. So let's draw some diagrams just
like before of the scopes.
First thing we're going to do is when we have a program, we're going to create the global
scope and we're going to add every variable that we have. And then when we reach a function
call, we're going to do something about that. So the first thing in the global scope is this
function definition. Again in my global scope, I just have g as some code because I have not"
Lecture4_Chunk83,"function definition. Again in my global scope, I just have g as some code because I have not
called it yet. I only go inside a function when I make a function call.
So g contains some code. So we're done with 75% of that code. Next line is x is equal to 3. So
I'm making x be a variable inside my global scope with value 3. And then I have this z is equal
to g of x. This is a function call. When I see a function call, I'm going to create a new scope. So
here is the scope of g."
Lecture4_Chunk84,"here is the scope of g.
With the scope of g, I'm mapping variables to actual parameters to formal parameters. So the
first thing I'm doing is I'm saying inside g what is the value of actual parameter x? And x is
going to be the value 3, because I've called g of x with x is equal to 3.
Next, what I see inside this function-- so this is the inside of the function-- is this bit here. It's
another function definition. Again since I'm just defining the function and I'm not calling it, all"
Lecture4_Chunk85,"another function definition. Again since I'm just defining the function and I'm not calling it, all
Python sees is h is some code. I haven't called the function h yet, because I'm just defining it
here with def. So that finishes this part here.
The next line is x is equal to x plus 1. So inside the scope of g, I'm incrementing x to be 4.
Then I'm printing out this line. And then I've reached here-- h. This is actually a function call,"
Lecture4_Chunk86,"Then I'm printing out this line. And then I've reached here-- h. This is actually a function call,
and I'm calling h. As soon as I make a function call, I'm creating another scope. So I'm
temporarily going out of the scope of g and going into the scope of h.
So Python knows that h contains some code, and now I can go inside h and do whatever I
need to do. So the first-- so h doesn't have any parameters, so I don't need to populate"
Lecture4_Chunk87,"need to do. So the first-- so h doesn't have any parameters, so I don't need to populate
anything like that in there. h does define a variable called x, which is abc; it's a string. And then
that's all h does. What does it return? None.
I heard murmuring, but I think None was what you guys were saying. So since there's no
return statement, h is going to return None. So h returns None. Back to whoever called it,"
Lecture4_Chunk88,"return statement, h is going to return None. So h returns None. Back to whoever called it,
which was this code inside g. So that gets replaced with None-- the thing that I've-- this circled
red h here. As soon as h returns, we're going to get rid of that scope-- all the variables created
within it-- and we're done with h.
So now we're back into g. And we just finished executing this and this got replaced with None."
Lecture4_Chunk89,"So now we're back into g. And we just finished executing this and this got replaced with None.
We're not printing it out, so this doesn't show up anywhere; it's just there. So we're finished
with that line.
And the next line is return x. So x inside g is 4, so 4 gets returned back to whoever called it,
which was in the global scope here. So this gets replaced with 4. So once we've returned x,
we've completely exited out of the scope of g, and we've come back to whoever called us,"
Lecture4_Chunk90,"we've completely exited out of the scope of g, and we've come back to whoever called us,
which was global scope and we've replaced z is equal to g of x and that completely got
replaced with 4-- the returned value.
So that's sort of showing nested functions. All right just circling back to decomposition-
abstraction. This is the last slide. You can see if you look at the code associated with today's
lecture, there are some other examples where you can see just how powerful it is to use"
Lecture4_Chunk91,"lecture, there are some other examples where you can see just how powerful it is to use
functions. And you can write really clean and simple code if you define your own functions and
then just use them later.
And the beauty of defining your own functions that you can use multiple times later is you only
have to debug the function once right? I know debugging is not your favorite thing, but you
only have to debug this one thing once, and then you can know that it's right and it works well,"
Lecture4_Chunk92,"only have to debug this one thing once, and then you can know that it's right and it works well,
and you can just use it multiple times. All right thanks everyone."
Lecture5_Chunk1,"MITOCW | watch?v=RvRKT-jXvko
The following content is provided under a Creative Commons license. Your support will help
MIT OpenCourseWare continue to offer high quality educational resources for free. To make a
donation or view additional materials from hundreds of MIT courses, visit MIT
OpenCourseWare at ocw.mit.edu.
PROFESSOR:
Quick, quick recap of what we did last time. So last time we introduced this idea of"
Lecture5_Chunk2,"PROFESSOR:
Quick, quick recap of what we did last time. So last time we introduced this idea of
decomposition and abstraction. And we started putting that into our programs. And these were
sort of high level concepts, and we achieved them using these concrete things called functions
in our programs. And functions allowed us to create code that was coherent, that had some
structure to it, and was reusable. OK."
Lecture5_Chunk3,"structure to it, and was reusable. OK.
And from now on in problem sets and in lectures, I'm going to be using functions a lot. So
make sure that you understand how they work and all of those details. So today, we're going
to introduce two new data types. And they're called compound data types, because they're
actually data types that are made up of other data types, particularly ints, floats, Booleans, and"
Lecture5_Chunk4,"actually data types that are made up of other data types, particularly ints, floats, Booleans, and
strings. And actually not just these, but other data types as well. So that's why they're called
compound data types.
So we're going to look at a new data type called a tuple and a new data type called a list. And
then we're going to talk about these ideas that come about with-- specifically with lists.
All right. So let's go right into tuples. So if you recall strings, strings were sequences of"
Lecture5_Chunk5,"All right. So let's go right into tuples. So if you recall strings, strings were sequences of
characters. Tuples are going to be similar to strings in that they're going to be sequences of
something, except that tuples aren't just sequences of characters, they can be sequences of
anything. They're a collection of data where that data can be of any type.
So a tuple can contain elements that are integers, floats, strings, and so on. Tuples are"
Lecture5_Chunk6,"So a tuple can contain elements that are integers, floats, strings, and so on. Tuples are
immutable. And if you recall, we talked about this word a little bit when we talked about strings.
So that means once you create a tuple object, you can't modify it. So when you created a
string object, you were not allowed to modify it.
So the way we create tuples are with these open and close parentheses. This shouldn't be"
Lecture5_Chunk7,"So the way we create tuples are with these open and close parentheses. This shouldn't be
confused with a function, because there's nothing-- there's no-- this isn't a function call. It's just
how you represent a tuple. For a function call, you'd have something right before the
parentheses. This is just how we chose to represent a tuple. And just a plain open and close
parentheses represents an empty tuple. So it's of length 0. There's nothing in it."
Lecture5_Chunk8,"parentheses represents an empty tuple. So it's of length 0. There's nothing in it.
You can create a tuple that contains some elements by separating each element with a
comma. So in this case, this is a tuple that can be accessed with a variable t that contains
three elements. The first is an integer, the second is a string, and the third is another integer.
Much like strings, we can index into tuples to find out values at particular indices. So you read"
Lecture5_Chunk9,"Much like strings, we can index into tuples to find out values at particular indices. So you read
this as t at position 0. So the tuple represented by a variable t at position 0 will evaluate to 2,
because again, we start counting from 0 in computer science. So that brings us-- gives us the
first element.
Just like strings, we can concatenate tuples together. That just means add them together. So if
we add these two tuples together, we just get back one larger tuple that's just those two-- the"
Lecture5_Chunk10,"we add these two tuples together, we just get back one larger tuple that's just those two-- the
elements of those tuples just put together in one larger tuple. Again, much like strings, we can
slice into tuples. So t sliced from index 1 until index 2. Remember, we go until this stop minus
1. So this only gives us one element inside the tuple.
And this is not a mistake. This extra comma here actually represents a tuple object. If I didn't"
Lecture5_Chunk11,"And this is not a mistake. This extra comma here actually represents a tuple object. If I didn't
have this comma here, then this would just be a string. The parentheses would just-- wouldn't
really make any difference. But the comma here makes it clear to Python that this is a tuple
with only one element in it.
We can slice even further to get a tuple with two elements. And we can do the usual
operations like get the length of a tuple, which says, how many elements are in my tuple? And"
Lecture5_Chunk12,"operations like get the length of a tuple, which says, how many elements are in my tuple? And
len of this t would evaluate to 3, because there are three elements inside the tuple. Each
element, again, separated by the comma.
And just like strings, if we try to change a value inside the tuple-- in this case, I wanted to try to
change the value of the second element to 4-- Python doesn't allow that, because tuples are
immutable."
Lecture5_Chunk13,"immutable.
So why would we want to use tuples? Tuples are actually useful in a couple of different
scenarios. So recall a few years ago, we looked at this code where we tried to swap the values
of variables x and y. And this first code actually didn't work, because you're overwriting the
value for x. So instead, what we ended up doing was creating this temporary variable where
we stored the value of x, and then we overwrote it, and then we used the temporary variable."
