Index,Text
Lecture7_Chunk18,"function, you might find a bug. At that point, you do regression testing. Come up with a test
case that found that bug. And run all of the different pieces of your code again to make sure
that when you fix the bug, you don't re-introduce new bugs into pieces of the code that had
already run.
So you do this a bunch of times. You do a little bit of unit testing, a little bit of regression
testing, and keep doing that. At some point, you're ready to do integration testing. Which"
Lecture7_Chunk19,"testing, and keep doing that. At some point, you're ready to do integration testing. Which
means, test your program as a whole. Does the overall program work? So this is the part
where you take all of the individual pieces, put them together. And integration testing tests to
make sure that the interactions between all of the different pieces works as expected. If it
does, great, you're done. But if it doesn't, then you'll have to go back to unit testing, and"
Lecture7_Chunk20,"does, great, you're done. But if it doesn't, then you'll have to go back to unit testing, and
regression testing, and so on. So it's really a cycle of testing.
So what are some testing approaches? The first, and this is probably most common with
programs that involve numbers, is figuring out some natural boundaries for the numbers-- for
the program, sorry. So for example, if I have a function is_bigger, and it compares if x is bigger"
Lecture7_Chunk21,"the program, sorry. So for example, if I have a function is_bigger, and it compares if x is bigger
than y, then some natural boundary, given the specification, is if x is less than y, x is greater
than y, x is equal to y. Maybe throw in less than or equal to or greater or equal to, and so on.
So that's just sort of an intuition about the problem. It's possible you have some problems for
which there are no natural partitions. In which case, you might do some random testing, and"
Lecture7_Chunk22,"which there are no natural partitions. In which case, you might do some random testing, and
then the more random testing you do, the greater the likelihood that your program is correct.
But there's actually two more rigorous ways to do testing. And one is black box testing and the
other one is glass box testing.
In black box testing, you're assuming you have the specifications to a function. So that's the"
Lecture7_Chunk23,"In black box testing, you're assuming you have the specifications to a function. So that's the
docstring. All you're looking at is the docstring and coming up with some test cases based on
that. In glass box testing, you have the code itself and you're trying to come up with some test
cases that hit upon all of the possible paths through the code.
All right. Let's look at an example for black box testing. I'm finding the square root of x to some"
Lecture7_Chunk24,"All right. Let's look at an example for black box testing. I'm finding the square root of x to some
close enough value given by this epsilon. And the idea here, notice I don't actually give you
how this function's implemented. The idea is that you're just figuring out test cases based on
the specification. And the great thing about black box testing is that whoever implements this
function can implement it in whatever way they wish, they can use approximation method, that"
Lecture7_Chunk25,"function can implement it in whatever way they wish, they can use approximation method, that
can use bisection method, it doesn't matter. The test cases that you come up with for this
function are going to be exactly the same. Right? No matter what the implementation.
So for this particular function, here's a sample set. We check the boundary, we check perfect
squares, we can check some number that's less than 1, we can check maybe irrationals, and"
Lecture7_Chunk26,"squares, we can check some number that's less than 1, we can check maybe irrationals, and
then you do extreme tests. So when either epsilon is really large or epsilon is really small, or x
is really large or x is really small, and all the possible combinations of those. So the important
thing about black box testing is that you are doing you are creating the test cases based on
the specifications only."
Lecture7_Chunk27,"the specifications only.
Glass box testing, you're using the code itself to guide your test cases. So if you have a piece
of code and you come up with a test case that goes through every single possible combination
of input-- of every single possible path through the code, then that test set is called path
complete. The problem with this is when you encounter loops, for example. Every single
possible path through a loop is maybe the code not going through the loop at all, going"
Lecture7_Chunk28,"possible path through a loop is maybe the code not going through the loop at all, going
through once, going through twice, going through three times, four times, five times, and so
on. Right? Which could be a very, very big test.
So instead there are actually some guidelines for when you're dealing with loops and things
like that. So for branches, when you're doing glass box testing, it's important-- you should just"
Lecture7_Chunk29,"like that. So for branches, when you're doing glass box testing, it's important-- you should just
exercise all of the parts of the conditional. So make sure you have a test case that goes
through each part of the conditional. For for loops, make sure you have a test case where the
loop is not entered at all, where the loop is entered one time, and when the loop is entered just
some number more than once."
Lecture7_Chunk30,"some number more than once.
For while loops, similar to for loops, except that make sure you have test cases that cover all
of the possible ways to break out of the while loop. So if the while loop condition becomes
false, or if maybe there's a break inside the while loop, and so on.
So in this example, we have the absolute value of x. This is its specification and this is the
implementation that someone decided to do for this function. So a path complete test set"
Lecture7_Chunk31,"implementation that someone decided to do for this function. So a path complete test set
means that you want to have a test that goes through each one of these branches. So if x is
less than minus 1, well, minus 2 is less than minus 1. So that's good. And otherwise, which
means pick a number greater than minus 1. So 2. So 2 and minus 2 are path complete. Yield
path complete-- yields a path complete test suite."
Lecture7_Chunk32,"path complete-- yields a path complete test suite.
But notice that while we've hit upon every possible path through this code, we've actually
missed a test case. Minus 1. So this code incorrectly classifies minus 1 as returning minus 1,
which is wrong. So for glass box testing, in addition to making sure you're going through all the
possible paths through the code, you also want to make sure you hit upon any boundary
condition. So in this case, for branches, minus 1 is a boundary condition."
Lecture7_Chunk33,"condition. So in this case, for branches, minus 1 is a boundary condition.
So you've created a test suite, you've tested your program, chances are you found a bug.
What do you do now?
All right. Quick sort of detour into a little bit of history. The history of debugging. So 1947, this
computer was built. And it was a computer that was very impressive for its day. It could do
things like addition in 0.1 seconds. Things like multiplication in 0.7 seconds. And take the log of"
Lecture7_Chunk34,"things like addition in 0.1 seconds. Things like multiplication in 0.7 seconds. And take the log of
something in five seconds. So faster than a human, possibly. But pretty slow for today's
standards. And a group of engineers were working on running a program that found-- that was
supposed to find the trigonometric function. And among them being this-- one of the first
female scientists, Grace Hopper.
And they found that their program was not working correctly. So they went through all of the"
Lecture7_Chunk35,"And they found that their program was not working correctly. So they went through all of the
panels and all of the relays in the computer, and they isolated a program in panel F relay 70,
where they found this moth. Just sitting in there. I think it was dead, probably electrocuted. But
it was a moth that was impeding the calculation. And I don't know if you can read this, but this
part right here. They made a note in their logbook that says, first actual case of bug being"
Lecture7_Chunk36,"part right here. They made a note in their logbook that says, first actual case of bug being
found. Which I think is really cute. So they were literally doing debugging in this computer.
Right. All right.
So you won't be doing that sort of debugging. You'll be doing a virtual kind of debugging in
your programs. Which, again, is not that fun. But you still have to do it. So debugging, as you
might have noticed so far in your problem sets, has a bit of a steep learning curve. And"
Lecture7_Chunk37,"might have noticed so far in your problem sets, has a bit of a steep learning curve. And
obviously your goal is to have a bug free program, and in order to achieve that, you have to do
the debugging.
There are some tools which some of you have been using. There are some tools built into
Anaconda, or whatever ID you've been using to do debugging. I know some of you have been
using the Python tutor, which is awesome. The print statement can also be a good debugging"
Lecture7_Chunk38,"using the Python tutor, which is awesome. The print statement can also be a good debugging
tool. But over above everything else, it's really important to just be systematic as you're trying
to debug your program.
I want to talk a little bit about print statements and how you can use them to debug, because I
think-- Python tutor, if you don't have the internet, you might not be able to use it. If you don't
know how to use the debugger, you don't need to learn. But print statements, you'll always"
Lecture7_Chunk39,"know how to use the debugger, you don't need to learn. But print statements, you'll always
have them, and you can always put them in your program. And they're really good ways to test
hypotheses.
So good places to put print statements are inside functions. Inside loops, for example, what
are the loop parameters, what are the loop values, what function-- what functions return what
values. So you can make sure that values are being passed-- the correct values are being"
Lecture7_Chunk40,"values. So you can make sure that values are being passed-- the correct values are being
passed between parts of your code. I will mention that you can use the bisection method when
you're debugging. Which is interesting.
So if you take a print statement, find approximately the halfway point in your code. Print out
what values you-- print out some relevant values. All of the possible-- print out some values at"
Lecture7_Chunk41,"what values you-- print out some relevant values. All of the possible-- print out some values at
that point in your code. If everything is as you expect it to be at that point in your code, then
you're good. That means the code so far is bug free. That means that-- however, that means
you're good. That means the code so far is bug free. That means that-- however, that means
that the code beyond it has a bug, right?"
Lecture7_Chunk42,"that the code beyond it has a bug, right?
So since you've put a print statement halfway in your code and you think that gave good
results, then put a print statement 3/4 of the way in the code. And see if the values are as you
expect at that point. And if they are, great. Then put a print statement further down. So in this
way you could use the bisection method to pinpoint a line, or a set of lines, or maybe a
function that that's giving you the bad results."
Lecture7_Chunk43,"function that that's giving you the bad results.
So the general debugging steps is to study the program code. Don't ask what is wrong,
because that's actually part of the testing. So your test cases would have figured out what's
wrong. The debugging process is figuring out how the result took place. And since
programming is-- programming and debugging is, sort of, is a science, you can use the
scientific method as well. So look at all the data, that's your test cases. Figure out a"
Lecture7_Chunk44,"scientific method as well. So look at all the data, that's your test cases. Figure out a
hypothesis. Maybe say, oh, maybe I'm indexing from 1 instead of 0 in lists, for example. Come
up with an experiment that you can repeat. And then pick a simple test case then you can test
your hypothesis with.
So as you're debugging, you will encounter error messages. And these error messages are
actually pretty easy to figure out. And they're really easy to fix in your code. So for example,"
Lecture7_Chunk45,"actually pretty easy to figure out. And they're really easy to fix in your code. So for example,
accessing things beyond the limits of the lists give you index errors. Trying to convert, in this
case, a list to an integer gives you type errors. Accessing variables that you haven't created
before gives you name errors. And so on and so on. And syntax errors are things, for things
like, if you forget a parentheses, or forget a colon, or something like that."
Lecture7_Chunk46,"like, if you forget a parentheses, or forget a colon, or something like that.
So error messages are really easy to spot. The Python interpreter spits these out for you and
then you can pinpoint the exact line. Logic errors are actually the hard part. And logic errors
are the ones that you will be spending the most time on. For which I would recommend always
trying to take a break. Take a nap, go eat. Something. Sometimes you'd have to start all over,"
Lecture7_Chunk47,"trying to take a break. Take a nap, go eat. Something. Sometimes you'd have to start all over,
so throughout the code you have and just sit down with a piece of paper, try to figure out how
you want to solve the problem.
And if you look up the term rubber ducky-- a lot of heads went up on that one-- rubber ducky
debugging. That is an actual term in Wikipedia. And it's when a programmer explains their
code to a rubber ducky. That's me on the left explaining code to my rubber ducky. You should"
Lecture7_Chunk48,"code to a rubber ducky. That's me on the left explaining code to my rubber ducky. You should
always-- you should go buy one. Or code to anyone else, preferably someone who doesn't
really understand anything. Because that'll force you to explain everything really, really closely.
And as you're doing that, you'll figure out your problem. And I figured out my problem in both
of these cases. So just go back to the basics."
Lecture7_Chunk49,"of these cases. So just go back to the basics.
Quick summary of dos and don'ts of debugging and testing. So don't write the entire program,
test the entire program, and debug the entire program. I know this is really tempting to do, and
I do it all the time. But don't do it. Because you're going to introduce a lot of bugs and it's going
to be hard to isolate which bugs are affecting other ones. And it'll lead to a lot more stress than"
Lecture7_Chunk50,"to be hard to isolate which bugs are affecting other ones. And it'll lead to a lot more stress than
you need. Instead do unit testing. So write one function, test the function, debug the function,
make sure it works, write the other function, and so on and so on. Do a little regression testing,
a little more unit testing, a little integration testing, and it's a lot more systematic way to write
the program. And it'll cut down on your debugging time immensely."
Lecture7_Chunk51,"the program. And it'll cut down on your debugging time immensely.
If you're changing your code, and inevitably you'll be changing your code as you're doing your
problem sets, remember to back up your code. So if you have a version that almost works,
don't just modify that and maybe save a copy. [INAUDIBLE] you've got terabytes of memory
on your computer, it won't hurt to just make a quick copy of it. Document maybe what worked"
Lecture7_Chunk52,"on your computer, it won't hurt to just make a quick copy of it. Document maybe what worked
and what didn't in that copy. And then make another copy, and then you can modify your
code.
So that's sort of a high level introduction to testing and debugging. The rest of the class will be
on the error messages, or on errors that you will get in your programs. So when your
functions-- when you run functions, or when you run your program, at some point, the"
Lecture7_Chunk53,"functions-- when you run functions, or when you run your program, at some point, the
program execution is going to stop. Maybe it encountered an error because of some
unexpected condition. And when that happens you get an exception. So the error is called an
exception. And it's called an exception because it was an exception to what was expected. To
what the program expected.
So all of these errors that I've talked about in the previous slides are actually examples of"
Lecture7_Chunk54,"So all of these errors that I've talked about in the previous slides are actually examples of
exceptions. And there are actually many other types of exceptions, which you'll see as you go
on in this course and also in 60002.
So how do we deal with these exceptions? In Python, you can actually have handlers for
exceptions. So if you know that a piece of code might give you an error. For example, here I'm"
Lecture7_Chunk55,"exceptions. So if you know that a piece of code might give you an error. For example, here I'm
dealing with inputs from users. And users are really unpredictable. You tell them to give you a
number, they might give you their name. Nothing you can do about that. Or is there? Yes
there is. So in your program you can actually put any lines of code that you think might be
problematic, that might give you an error an exception, in this try block. So you say try colon,"
Lecture7_Chunk56,"problematic, that might give you an error an exception, in this try block. So you say try colon,
and you put in any lines of code that you think might give you an error.
If none of these lines of code actually produce an error, then great. Python doesn't do
anything else. It treats them as just part-- as just if they were part of a regular program. But if
an error does come up-- for example, if someone doesn't put in a number but puts their name"
Lecture7_Chunk57,"an error does come up-- for example, if someone doesn't put in a number but puts their name
in-- that's going to raise an error, specifically a value error. And at that point, Python's going to
say, is there an accept statement? And if so, this except statement is going to handle the
error.
And it's going say, OK, an error came up, but I know how to handle it. I'm going to print out this
message to the user. So if we look at code-- this is the same code as in the slides-- and"
Lecture7_Chunk58,"message to the user. So if we look at code-- this is the same code as in the slides-- and
there's no try except block around it. So if I run it and I say, three and four, it's going to run
fine. But if I run it and I say, [INAUDIBLE] a, it's going to give a value error.
Now if I run the same piece of code with try-- with a try except block. I run it, if I give it regular
numbers, it's fine. But if I'm being a cheeky user, and I say three, automatically this would"
Lecture7_Chunk59,"numbers, it's fine. But if I'm being a cheeky user, and I say three, automatically this would
have raised the value error in the previous version of the program. But in this version of the
program, the programmer handled the exception or caught the exception, and printed out this
nicer looking message. So bug in user input is nicer than this whole lot here. A lot easier to
read.
So any problematic lines of code, you can put in a try block, and then handle whatever errors"
Lecture7_Chunk60,"read.
So any problematic lines of code, you can put in a try block, and then handle whatever errors
might come up in this except block. This except block is going to catch any error that comes
up. And you can actually get a little bit more specific and catch specific types of errors. In this
case, I'm saying, if a value error comes up-- for example, if the user inputs a string instead of
an integer-- do this, which is going to print this message. If the user inputs a number for B"
Lecture7_Chunk61,"an integer-- do this, which is going to print this message. If the user inputs a number for B
such that we're doing a divided by b, so that would give a 0 division error. In that case we're
going to catch this other error here, the 0 division error, and we're going to print this other
message, can't divide by 0.
So each-- so you can think of these different except blocks as sort of if else if statements,"
Lecture7_Chunk62,"So each-- so you can think of these different except blocks as sort of if else if statements,
except for exceptions. So we're going to try this. But if there's a value error do this. Otherwise,
if there's a division error, do this. And otherwise do this. So this last except is actually going to
be for any other error that comes up. So if it's not a value error, nor a division error, then we're
going to print, something went very wrong. I couldn't even try to create-- I couldn't even try to"
Lecture7_Chunk63,"going to print, something went very wrong. I couldn't even try to create-- I couldn't even try to
make the program come up with any other error besides those two.
So a lot of the time you're just going to use try except blocks. But there's other blocks that you
can add to exceptions. And these are more rarely used, but I'll talk about them anyway. So
you could have an else block. And an else block is going to get executed when the code in the"
Lecture7_Chunk64,"you could have an else block. And an else block is going to get executed when the code in the
try block finished without raising an error. And you can also have a finally block, which is
always executed. If the code in the try block finished without an error, if you raised an
exception, if you raised a different kind of exception, if you went through the else, in any of
these cases, whatever's in the finally block is always going to get executed. And it's usually"
Lecture7_Chunk65,"these cases, whatever's in the finally block is always going to get executed. And it's usually
used to clean up code. Like if you want to print, oh, the program finished, or if you want to
close a file, or something like that.
So. We've encountered errors. We've caught them. What else can we do with errors-- with
exceptions. Three other things. So one is if we've caught an error, we can just fail silently."
Lecture7_Chunk66,"exceptions. Three other things. So one is if we've caught an error, we can just fail silently.
What this means is, you've caught an error, and you just substitute whatever erroneous value
the user gave you for some other value. That's not actually a very good idea. That's a bad
idea. Because suddenly the user thinks that they entered something, and they think
everything's great, your program accepts it, but then they get some weird value as an output,"
Lecture7_Chunk67,"everything's great, your program accepts it, but then they get some weird value as an output,
which is far from what they expected. So it's not really a good idea to just replace user's values
with anything.
In the context-- so this is in the context of a function. In the context of a function, what else can
we do? Well, if you have a function that fails, for example, let's say you're trying to do you're
trying to get the square root of an even number. And let's say the user gives you a-- sorry,"
Lecture7_Chunk68,"trying to get the square root of an even number. And let's say the user gives you a-- sorry,
you're trying to find the square root of a positive number. And let's say the user gives you a
negative number. Well, if the user gives you a negative number, your function could return an
error value, which means, well if the number inputted is less than 0, then return 0. Or minus 1.
Or minus 100. Just pick any value to return which represents some error value."
Lecture7_Chunk69,"Or minus 100. Just pick any value to return which represents some error value.
This is actually not a good idea either, because later on in your program, if you're using this
function, now you have to do a check. And the check is, well if the return from this function is
minus 1 or minus 100, do this. Otherwise, do this. So you you're complicating your code
because now you always have to have this check for this error value. Which makes the code
really messy."
Lecture7_Chunk70,"really messy.
The other thing we can do is we can signal an error condition. So this is how you create
control flow in your programs with exceptions. So in Python, signaling an error condition
means raising your own exception. So so far we've just seen the programs crashing, which
means they raise an exception and then you deal with them. But in this last case, you're
raising your own exception. As a way to use that exception later on in the code. So in Python,"
Lecture7_Chunk71,"raising your own exception. As a way to use that exception later on in the code. So in Python,
you raise your own exception using this raise keyword and then an exception. And then some
sort of description, like ""user entered a negative number"" or something like that.
A lot of the time we're going to raise a value error. So if the number is less than 0, then raise a
value error, something is wrong. The key word, the name of the error, and then some sort of
descriptive string."
